{
 "interface_version": "1.0.0",
 "identity": {
  "id": "S38",
  "name": "Patient Pullback-into-Zone",
  "slug": "S38_patient_pullback_into_zone",
  "version": "1.0.0",
  "class": "Class VII \u2014 trend continuation (redesign of S7/S10)"
 },
 "lifecycle": {
  "status": "IMPLEMENTED",
  "maturity": "EXPLORATORY",
  "current_health": "OK",
  "last_review": "2026-07-15"
 },
 "semantics": {
  "mechanism": "In an HTF trend, enter on a pullback INTO a discount zone (EMA20/EMA50/fib-0.5) WITHOUT waiting for a confirmation close (better fill than the confirmation crowd). Approximated by market-on-next-open.",
  "signal_reason": "HTF trend; onset of price tagging the zone (uptrend pullback down / downtrend pullback up); enter next open.",
  "market_regime": {
   "applicable": [
    "ANY"
   ],
   "avoid": []
  },
  "required_data": [
   {
    "timeframe": "M15",
    "fields": [
     "m_ema20",
     "rmax20",
     "rmin20",
     "m_atr"
    ],
    "lookback_bars": 2,
    "htf": [
     "H1"
    ]
   }
  ],
  "required_confirmations": [
   "PATIENT_PULLBACK_INTO_EMA20_ZONE"
  ]
 },
 "execution": {
  "timeframe": "M15",
  "sessions": "All sessions",
  "long_short": "BOTH",
  "entry": {
   "description": "Fresh onset of price tagging EMA20 in the direction of an H1 pullback, no confirmation required.",
   "trigger": "PATIENT_PULLBACK_INTO_EMA20_ZONE",
   "timing": "next_open_after_signal"
  },
  "exit": {
   "description": "Trailing stop (1.5*ATR-at-entry, ratchets in the trade's favor); no fixed price target.",
   "options": [
    "trailing"
   ]
  },
  "stop": {
   "description": "The 20-bar rolling extreme (stop='swing'), floored.",
   "trigger": "swing"
  },
  "risk_model": {
   "model": "risk-normalised (1R per trade)",
   "risk_definition": "risk = |entry - executable_stop|; result R = (dir*(exit-entry) - 2*cost)/risk",
   "stop_floor": "executable risk = max(2*spread_ticks*tick, 5*tick, 0.10*ATR) = max(0.20, 0.50, 0.10*ATR) price units (v2, pre-registered)",
   "costs": "(spread 1 + slippage 1) ticks/side * 0.1 = 0.10/side; 0.20 round-trip charged in R"
  },
  "position_sizing": {
   "model": "risk-normalised (1R per trade)",
   "risk_definition": "risk = |entry - executable_stop|; result R = (dir*(exit-entry) - 2*cost)/risk",
   "stop_floor": "executable risk = max(2*spread_ticks*tick, 5*tick, 0.10*ATR) = max(0.20, 0.50, 0.10*ATR) price units (v2, pre-registered)",
   "costs": "(spread 1 + slippage 1) ticks/side * 0.1 = 0.10/side; 0.20 round-trip charged in R",
   "concurrency": "ONE position at a time (overlapping signals suppressed until the open trade closes)",
   "absolute_size": "lot = per-trade risk budget / risk-distance \u2014 an EXECUTION-LAYER decision, NOT set by the research"
  },
  "max_concurrent_positions": 1,
  "expected_frequency": {
   "trades_per_year": null,
   "basis": "not computed from v0 spec"
  },
  "cooldown": {
   "bars": 0,
   "scope": "PER_STRATEGY"
  },
  "invalid_conditions": [
   "ATR non-finite or <= 0 at the signal bar",
   "signal on the last available bar (no next-open to fill)",
   "a position is already open (overlap suppression)"
  ]
 },
 "evidence": {
  "confidence": {
   "level": "NEGATIVE",
   "rationale": "NEGATIVE \u2014 family unprofitable on the research segment"
  },
  "historical_metrics": {
   "segment": "historical",
   "n": 2269,
   "expectancy_R": -0.2386,
   "profit_factor": 0.371,
   "drawdown_R": 541.46,
   "win_rate": 0.263,
   "pos_months": 1,
   "months": 27,
   "top1_share": 0.017
  },
  "oos_metrics": {
   "segment": "oos",
   "n": null,
   "expectancy_R": -0.1003,
   "profit_factor": 0.371,
   "drawdown_R": 541.46,
   "win_rate": null,
   "pos_months": null,
   "months": null,
   "top1_share": null
  },
  "walk_forward_status": "NOT_RUN",
  "matched_null_status": {
   "status": "NOT_RUN",
   "scope": "WAVE1",
   "note": "NOT RUN \u2014 matched-null was applied only to the pre-registered pilot and the Wave-1 representatives. The analytic normal-approx p-value is INVALIDATED (PROJECT_AUDIT D1) and is not used as a verdict.",
   "p": null,
   "adjusted_p": null
  },
  "global_fdr_status": "NOT_RUN",
  "validation_status": "EXPLORATORY \u2014 historical research segment only. No confirmed alpha. Holdout SEALED; global-FDR NOT run; walk-forward NOT run. Family: 36 hypotheses, 0 historically-profitable, 0 research-worthy. Representative 7ceb32e972b6: n=2269, exp=-0.2386R, PF=0.371, maxDD=541.46R, OOS exp=-0.1003R, pos-months 1/27, not profitable. ",
  "known_limitations": [
   "NEGATIVE \u2014 family unprofitable on the research segment",
   "NOT RUN \u2014 matched-null was applied only to the pre-registered pilot and the Wave-1 representatives. The analytic normal-approx p-value is INVALIDATED (PROJECT_AUDIT D1) and is not used as a verdict."
  ]
 },
 "provenance": {
  "engine": "mstrat.py v2 (FROZEN)",
  "generated_from": "frozen research; NO re-backtest, NO optimisation, NO engine change",
  "holdout_status": "SEALED",
  "source_ref": "S38_patient_pullback_into_zone"
 }
}
