{
 "interface_version": "1.0.0",
 "identity": {
  "id": "S21",
  "name": "Equal-Highs/Lows Liquidity-Pool Raid",
  "slug": "S21_equal_highs_lows_liquidity_pool_raid",
  "version": "1.0.0",
  "class": "Class I \u2014 resting liquidity"
 },
 "lifecycle": {
  "status": "IMPLEMENTED",
  "maturity": "EXPLORATORY",
  "current_health": "OK",
  "last_review": "2026-07-15"
 },
 "semantics": {
  "mechanism": "Stops/breakout orders pool at CLUSTERS of equal highs/lows (a level tested >=2x). Large players raid the pool then price reverses. Stronger/rarer than S1 (requires a multi-touch pool).",
  "signal_reason": "A level touched >= min_touches times in the last 20 bars, then a raid (sweep beyond) with a close back inside; enter next open (reversal).",
  "market_regime": {
   "applicable": [
    "ANY"
   ],
   "avoid": []
  },
  "required_data": [
   {
    "timeframe": "M15",
    "fields": [
     "rmax20",
     "m_atr"
    ],
    "lookback_bars": 21
   }
  ],
  "required_confirmations": [
   "EQUAL_HIGHS_POOL",
   "RAID_REJECT"
  ]
 },
 "execution": {
  "timeframe": "M15",
  "sessions": "All sessions",
  "long_short": "BOTH",
  "entry": {
   "description": "The 20-bar rolling high touched >=2 times in the prior 20 bars, then a wick-sweep-and-reject raid.",
   "trigger": "EQUAL_HIGHS_POOL + RAID_REJECT",
   "timing": "next_open_after_signal"
  },
  "exit": {
   "description": "2R fixed target.",
   "options": [
    "rr2"
   ]
  },
  "stop": {
   "description": "2 ticks beyond the raid extreme (stop='beyond_raid'), floored.",
   "trigger": "beyond_raid"
  },
  "target": {
   "description": "2R fixed target from entry/stop distance."
  },
  "risk_model": {
   "model": "risk-normalised (1R per trade)",
   "risk_definition": "risk = |entry - executable_stop|; result R = (dir*(exit-entry) - 2*cost)/risk",
   "stop_floor": "executable risk = max(2*spread_ticks*tick, 5*tick, 0.10*ATR) = max(0.20, 0.50, 0.10*ATR) price units (v2, pre-registered)",
   "costs": "(spread 1 + slippage 1) ticks/side * 0.1 = 0.10/side; 0.20 round-trip charged in R"
  },
  "position_sizing": {
   "model": "risk-normalised (1R per trade)",
   "risk_definition": "risk = |entry - executable_stop|; result R = (dir*(exit-entry) - 2*cost)/risk",
   "stop_floor": "executable risk = max(2*spread_ticks*tick, 5*tick, 0.10*ATR) = max(0.20, 0.50, 0.10*ATR) price units (v2, pre-registered)",
   "costs": "(spread 1 + slippage 1) ticks/side * 0.1 = 0.10/side; 0.20 round-trip charged in R",
   "concurrency": "ONE position at a time (overlapping signals suppressed until the open trade closes)",
   "absolute_size": "lot = per-trade risk budget / risk-distance \u2014 an EXECUTION-LAYER decision, NOT set by the research"
  },
  "max_concurrent_positions": 1,
  "expected_frequency": {
   "trades_per_year": null,
   "basis": "not computed from v0 spec"
  },
  "cooldown": {
   "bars": 0,
   "scope": "PER_STRATEGY"
  },
  "invalid_conditions": [
   "ATR non-finite or <= 0 at the signal bar",
   "signal on the last available bar (no next-open to fill)",
   "a position is already open (overlap suppression)"
  ]
 },
 "evidence": {
  "confidence": {
   "level": "NEGATIVE",
   "rationale": "NEGATIVE \u2014 family unprofitable on the research segment"
  },
  "historical_metrics": {
   "segment": "historical",
   "n": 2354,
   "expectancy_R": -0.3669,
   "profit_factor": 0.586,
   "drawdown_R": 868.62,
   "win_rate": 0.314,
   "pos_months": 0,
   "months": 27,
   "top1_share": 0.002
  },
  "oos_metrics": {
   "segment": "oos",
   "n": null,
   "expectancy_R": -0.2608,
   "profit_factor": 0.586,
   "drawdown_R": 868.62,
   "win_rate": null,
   "pos_months": null,
   "months": null,
   "top1_share": null
  },
  "walk_forward_status": "NOT_RUN",
  "matched_null_status": {
   "status": "NOT_RUN",
   "scope": "WAVE1",
   "note": "NOT RUN \u2014 matched-null was applied only to the pre-registered pilot and the Wave-1 representatives. The analytic normal-approx p-value is INVALIDATED (PROJECT_AUDIT D1) and is not used as a verdict.",
   "p": null,
   "adjusted_p": null
  },
  "global_fdr_status": "NOT_RUN",
  "validation_status": "EXPLORATORY \u2014 historical research segment only. No confirmed alpha. Holdout SEALED; global-FDR NOT run; walk-forward NOT run. Family: 48 hypotheses, 0 historically-profitable, 0 research-worthy. Representative 6ddb75c3f9b1: n=2354, exp=-0.3669R, PF=0.586, maxDD=868.62R, OOS exp=-0.2608R, pos-months 0/27, not profitable. ",
  "known_limitations": [
   "NEGATIVE \u2014 family unprofitable on the research segment",
   "NOT RUN \u2014 matched-null was applied only to the pre-registered pilot and the Wave-1 representatives. The analytic normal-approx p-value is INVALIDATED (PROJECT_AUDIT D1) and is not used as a verdict."
  ]
 },
 "provenance": {
  "engine": "mstrat.py v2 (FROZEN)",
  "generated_from": "frozen research; NO re-backtest, NO optimisation, NO engine change",
  "holdout_status": "SEALED",
  "source_ref": "S21_equal_highs_lows_liquidity_pool_raid"
 }
}
